summary,value,keywords,description,image
Foundation of the FIFA,1904,"20th Century,Organization","The Fédération internationale de football association is the international governing body of association football, beach soccer, and futsal. It was founded in 1904 to oversee international competition among the national associations of Belgium, Denmark, France, Germany, the Netherlands, Spain, Sweden and Switzerland.",https://assets.sutori.com/user-uploads/image/ea257c29-d6d8-4ccb-a952-0d24ebd46353/651a71c9ef315ab173f6aed86e2025a4.jpeg
Foundation of the UN,1945,"20th Century,Organization","The United Nations was established in the aftermath of World War II to promote international cooperation, peace, and security among nations.",https://i.ytimg.com/vi/Qvhc9d0TN9c/maxresdefault.jpg
Foundation of UNICEF,1946,"20th Century,Organization","UNICEF was created to provide emergency food and healthcare to children in war-torn Europe, and it has since evolved into an organization focused on children's rights and well-being worldwide.",https://www.un.org/youthenvoy/wp-content/uploads/2014/09/unicef_twitter1.png
Foundation of IMF,1944,"20th Century,Organization","The IMF was established to promote international monetary cooperation, exchange rate stability, balanced growth of international trade, and the resources to help member countries in need.",https://cloudfront-us-east-2.images.arcpublishing.com/reuters/RLLC6SXIEFJX5O4XXDTFVWKRAA.jpg
Foundation of the World Bank,1944,"20th Century,Organization",The World Bank was founded to provide financial and technical assistance for the development of infrastructure and economic projects in developing countries.,https://centerforearthethics.org/wp-content/uploads/2023/04/World-Bank-1024x570-1.jpg
Foundation of the WHO,1948,"20th Century,Organization","The WHO was created to address global health issues, with a focus on international public health, disease prevention, and the well-being of all people.",https://leslynlewismp.ca/wp-content/uploads/sites/28/2022/09/schemaOrgLogo.jpg
Foundation of the NATO,1949,"20th Century,Organization","NATO was formed as a military alliance for collective defense against external aggression, providing security and cooperation among its member countries.",https://photos.watchmedier.dk/watchmedier/resize:fill:3840:0:0/plain/https://photos.watchmedier.dk/Images/article13994595.ece/ALTERNATES/schema-16_9/20211021-103930-2-1600x900we.jpg